{
    "title": { "text": "Sorted Funnel" },
    "tooltip": { "trigger": "item" },
    "legend": { "data": ["Stage"] },
    "series": [
      {
        "name": "Stages",
        "type": "funnel",
        "sort": "ascending",
        "data": [
          { "value": 60, "name": "Visit" },
          { "value": 40, "name": "Inquiry" },
          { "value": 20, "name": "Order" },
          { "value": 80, "name": "Click" }
        ]
      }
    ]

}