{
    "title": { "text": "Multiple Radar" },
    "tooltip": {},
    "legend": { "data": ["Allocated Budget", "Actual Spending"] },
    "radar": {
      "indicator": [
        { "name": "Quality", "max": 100 },
        { "name": "Speed", "max": 100 },
        { "name": "Reliability", "max": 100 }
      ]
    },
    "series": [
      {
        "name": "Radar 1",
        "type": "radar",
        "data": [
          { "value": [60, 73, 85], "name": "Allocated Budget" },
          { "value": [50, 80, 90], "name": "Actual Spending" }
        ]
      },
      {
        "name": "Radar 2",
        "type": "radar",
        "data": [
          { "value": [70, 60, 95], "name": "Allocated Budget" },
          { "value": [65, 75, 85], "name": "Actual Spending" }
        ]
      }
    ]
}