{
    "title": { "text": "Comparison Funnel" },
    "tooltip": { "trigger": "item" },
    "legend": { "data": ["Product A", "Product B"] },
    "series": [
      {
        "name": "Product A",
        "type": "funnel",
        "width": "45%",
        "data": [
          { "value": 60, "name": "Visit" },
          { "value": 40, "name": "Inquiry" },
          { "value": 20, "name": "Order" },
          { "value": 80, "name": "Click" },
          { "value": 100, "name": "Show" }
        ]
      },
      {
        "name": "Product B",
        "type": "funnel",
        "width": "45%",
        "x": "55%",
        "data": [
          { "value": 30, "name": "Visit" },
          { "value": 20, "name": "Inquiry" },
          { "value": 10, "name": "Order" },
          { "value": 50, "name": "Click" },
          { "value": 70, "name": "Show" }
        ]
      }
    ]

}