{
    "title": { "text": "Filled Radar" },
    "tooltip": {},
    "radar": {
      "indicator": [
        { "name": "Sales", "max": 6500 },
        { "name": "Administration", "max": 16000 },
        { "name": "IT", "max": 30000 },
        { "name": "Support", "max": 38000 }
      ]
    },
    "series": [
      {
        "name": "Budget vs Spending",
        "type": "radar",
        "data": [
          { "value": [4200, 3000, 20000, 35000], "name": "Allocated" },
          { "value": [5000, 14000, 28000, 26000], "name": "Actual", "areaStyle": {} }
        ]
      }
    ]
}