{
    "title": { "text": "Stacked Bar Example" },
    "tooltip": { "trigger": "axis" },
    "xAxis": { "data": ["Mon", "Tue", "Wed", "Thu", "Fri"] },
    "yAxis": {},
    "series": [
      { "type": "bar", "stack": "total", "data": [120, 132, 101, 134, 90] },
      { "type": "bar", "stack": "total", "data": [220, 182, 191, 234, 290] }
    ]
}