{
    "title": { "text": "Bubble Scatter Example" },
    "xAxis": {},
    "yAxis": {},
    "series": [
      {
        "type": "scatter",
        "data": [
          [10, 8, 15],
          [20, 15, 30],
          [30, 22, 45]
        ],
        "symbolSize": "function (data) { return data[2]; }"
      }
    ]
}