{
    "title": { "text": "Multiple Boxplots" },
    "tooltip": {},
    "xAxis": { "type": "category", "data": ["Sample1", "Sample2"] },
    "series": [
      {
        "name": "Group A",
        "type": "boxplot",
        "data": [
          [655, 850, 940, 980, 1175],
          [620, 780, 840, 900, 1100]
        ]
      },
      {
        "name": "Group B",
        "type": "boxplot",
        "data": [
          [700, 880, 960, 1010, 1200],
          [680, 830, 900, 960, 1100]
        ]
      }
    ]
}